{
  "cases_failed": 0,
  "cases_passed": 26,
  "cases_total": 26,
  "document_type": "aset-component-conformance-results",
  "profile": "0.1-rc1",
  "results": [
    {
      "details": "accepted",
      "expected": "ACCEPT",
      "id": "POS-COMP-001",
      "observed": "ACCEPT",
      "status": "PASS"
    },
    {
      "details": "accepted",
      "expected": "ACCEPT",
      "id": "POS-COMP-002",
      "observed": "ACCEPT",
      "status": "PASS"
    },
    {
      "details": "accepted",
      "expected": "ACCEPT",
      "id": "POS-COMP-003",
      "observed": "ACCEPT",
      "status": "PASS"
    },
    {
      "details": "accepted",
      "expected": "ACCEPT",
      "id": "POS-COMP-004",
      "observed": "ACCEPT",
      "status": "PASS"
    },
    {
      "details": "accepted",
      "expected": "ACCEPT",
      "id": "POS-COMP-005",
      "observed": "ACCEPT",
      "status": "PASS"
    },
    {
      "details": "accepted",
      "expected": "ACCEPT",
      "id": "POS-COMP-006",
      "observed": "ACCEPT",
      "status": "PASS"
    },
    {
      "details": "accepted",
      "expected": "ACCEPT",
      "id": "POS-COMP-007",
      "observed": "ACCEPT",
      "status": "PASS"
    },
    {
      "details": "accepted",
      "expected": "ACCEPT",
      "id": "POS-COMP-008",
      "observed": "ACCEPT",
      "status": "PASS"
    },
    {
      "details": "accepted",
      "expected": "ACCEPT",
      "id": "POS-COMP-009",
      "observed": "ACCEPT",
      "status": "PASS"
    },
    {
      "details": "accepted",
      "expected": "ACCEPT",
      "id": "POS-COMP-010",
      "observed": "ACCEPT",
      "status": "PASS"
    },
    {
      "details": "accepted",
      "expected": "ACCEPT",
      "id": "POS-COMP-011",
      "observed": "ACCEPT",
      "status": "PASS"
    },
    {
      "details": "accepted",
      "expected": "ACCEPT",
      "id": "POS-COMP-012",
      "observed": "ACCEPT",
      "status": "PASS"
    },
    {
      "details": "canonical digest mismatch",
      "expected": "REJECT",
      "id": "NEG-COMP-001",
      "observed": "REJECT",
      "status": "PASS"
    },
    {
      "details": "schema::Additional properties are not allowed ('unexpected' was unexpected)",
      "expected": "REJECT",
      "id": "NEG-COMP-002",
      "observed": "REJECT",
      "status": "PASS"
    },
    {
      "details": "component boundary forbids classification:AUTHORIZATION_ISSUANCE; seed mapping mismatch:MASTER-PLAN:seed_transition_required; seed mapping mismatch:MASTER-PLAN:sequence",
      "expected": "REJECT",
      "id": "NEG-COMP-003",
      "observed": "REJECT",
      "status": "PASS"
    },
    {
      "details": "component boundary forbids classification:VERIFICATION_PROCESSING; seed mapping mismatch:MEM-PROJECT:seed_transition_required; seed mapping mismatch:MEM-PROJECT:sequence",
      "expected": "REJECT",
      "id": "NEG-COMP-004",
      "observed": "REJECT",
      "status": "PASS"
    },
    {
      "details": "component boundary forbids classification:EXTERNAL_EFFECT; seed mapping mismatch:CORE-RESOLVE:sequence; seed mapping mismatch:CORE-RESOLVE:outcome_recognition_required",
      "expected": "REJECT",
      "id": "NEG-COMP-005",
      "observed": "REJECT",
      "status": "PASS"
    },
    {
      "details": "external effect sequence differs",
      "expected": "REJECT",
      "id": "NEG-COMP-006",
      "observed": "REJECT",
      "status": "PASS"
    },
    {
      "details": "outcome sequence lacks Verification before Outcome",
      "expected": "REJECT",
      "id": "NEG-COMP-007",
      "observed": "REJECT",
      "status": "PASS"
    },
    {
      "details": "duplicate assignment or count mismatch:requirements",
      "expected": "REJECT",
      "id": "NEG-COMP-008",
      "observed": "REJECT",
      "status": "PASS"
    },
    {
      "details": "duplicate assignment or count mismatch:requirements; source partition mismatch:requirements",
      "expected": "REJECT",
      "id": "NEG-COMP-009",
      "observed": "REJECT",
      "status": "PASS"
    },
    {
      "details": "component digest mismatch:aset.context",
      "expected": "REJECT",
      "id": "NEG-COMP-010",
      "observed": "REJECT",
      "status": "PASS"
    },
    {
      "details": "schema:gates:[{'authority_component': 'aset.core', 'document': 'ExpectationAdmissionSubmission', 'document_schema': 'expectation-admission-submission.schema.json', 'external_effect': False, 'failure_codes': ['SOURCE_CONTEXT_STALE', 'PERMIT_MISSING', 'PERMIT_EXPIRED', 'PERMIT_SCOPE_MISMATCH', 'SCHEMA_INVALID', 'PRECONDITION_FAILED', 'CONCURRENT_CROSSING', 'REDUCER_FAILURE'], 'id': 'GATE-EXPECT-ADMIT', 'patch': 'ExpectedChangePatch', 'patch_schema': 'expected-change-patch.schema.json', 'permit': 'ExpectationPermit', 'permit_schema': 'expectation-permit.schema.json', 'producer': 'aset-master', 'producer_component': 'aset.master', 'reducer_id': 'reducer:gate-expect-admit:v1', 'schema_component': 'aset.protocol', 'writes': ['CTX-MAST', 'CTX-TASK']}, {'authority_component': 'aset.core', 'document': 'ExecutionBindingSubmission', 'document_schema': 'execution-binding-submission.schema.json', 'external_effect': False, 'failure_codes': ['SOURCE_CONTEXT_STALE', 'PERMIT_MISSING', 'PERMIT_EXPIRED', 'PERMIT_SCOPE_MISMATCH', 'SCHEMA_INVALID', 'PRECONDITION_FAILED', 'CONCURRENT_CROSSING', 'REDUCER_FAILURE'], 'id': 'GATE-EXEC-BIND', 'patch': 'OperationalBindingPatch', 'patch_schema': 'operational-binding-patch.schema.json', 'permit': 'ExecutionBindingPermit', 'permit_schema': 'execution-binding-permit.schema.json', 'producer': 'aset-monade-execution', 'producer_component': 'aset.monade', 'reducer_id': 'reducer:gate-exec-bind:v1', 'schema_component': 'aset.protocol', 'writes': ['CTX-EXEC']}, {'authority_component': 'aset.core', 'document': 'ExecutionDispatchSubmission', 'document_schema': 'execution-dispatch-submission.schema.json', 'external_effect': True, 'failure_codes': ['SOURCE_CONTEXT_STALE', 'PERMIT_MISSING', 'PERMIT_EXPIRED', 'PERMIT_SCOPE_MISMATCH', 'SCHEMA_INVALID', 'PRECONDITION_FAILED', 'CONCURRENT_CROSSING', 'REDUCER_FAILURE'], 'id': 'GATE-DISPATCH', 'patch': 'ExecutionIntentPatch', 'patch_schema': 'execution-intent-patch.schema.json', 'permit': 'ExecutionPermit', 'permit_schema': 'execution-permit.schema.json', 'producer': 'aset-monade-execution', 'producer_component': 'aset.monade', 'reducer_id': 'reducer:gate-dispatch:v1', 'schema_component': 'aset.protocol', 'writes': ['CTX-EXEC', 'CTX-AUTH']}, {'authority_component': 'aset.core', 'document': 'ObservationSubmission', 'document_schema': 'observation-submission.schema.json', 'external_effect': False, 'failure_codes': ['SOURCE_CONTEXT_STALE', 'PERMIT_MISSING', 'PERMIT_EXPIRED', 'PERMIT_SCOPE_MISMATCH', 'SCHEMA_INVALID', 'PRECONDITION_FAILED', 'CONCURRENT_CROSSING', 'REDUCER_FAILURE'], 'id': 'GATE-OBSERVE', 'patch': 'ObservationPatch', 'patch_schema': 'observation-patch.schema.json', 'permit': 'ObservationAdmissionPermit', 'permit_schema': 'observation-admission-permit.schema.json', 'producer': 'aset-monade-execution', 'producer_component': 'aset.monade', 'reducer_id': 'reducer:gate-observe:v1', 'schema_component': 'aset.protocol', 'writes': ['CTX-EXEC']}, {'authority_component': 'aset.core', 'document': 'EvidenceSubmission', 'document_schema': 'evidence-submission.schema.json', 'external_effect': False, 'failure_codes': ['SOURCE_CONTEXT_STALE', 'PERMIT_MISSING', 'PERMIT_EXPIRED', 'PERMIT_SCOPE_MISMATCH', 'SCHEMA_INVALID', 'PRECONDITION_FAILED', 'CONCURRENT_CROSSING', 'REDUCER_FAILURE'], 'id': 'GATE-EVIDENCE', 'patch': 'EvidencePatch', 'patch_schema': 'evidence-patch.schema.json', 'permit': 'EvidenceAdmissionPermit', 'permit_schema': 'evidence-admission-permit.schema.json', 'producer': 'aset-monade-acceptance', 'producer_component': 'aset.monade', 'reducer_id': 'reducer:gate-evidence:v1', 'schema_component': 'aset.protocol', 'writes': ['CTX-ACCE']}, {'authority_component': 'aset.core', 'document': 'AcceptanceSubmission', 'document_schema': 'acceptance-submission.schema.json', 'external_effect': False, 'failure_codes': ['SOURCE_CONTEXT_STALE', 'PERMIT_MISSING', 'PERMIT_EXPIRED', 'PERMIT_SCOPE_MISMATCH', 'SCHEMA_INVALID', 'PRECONDITION_FAILED', 'CONCURRENT_CROSSING', 'REDUCER_FAILURE'], 'id': 'GATE-ACCEPT', 'patch': 'AcceptanceResultPatch', 'patch_schema': 'acceptance-result-patch.schema.json', 'permit': 'AcceptancePermit', 'permit_schema': 'acceptance-permit.schema.json', 'producer': 'aset-monade-acceptance', 'producer_component': 'aset.monade', 'reducer_id': 'reducer:gate-accept:v1', 'schema_component': 'aset.protocol', 'writes': ['CTX-ACCE', 'CTX-TASK']}, {'authority_component': 'aset.core', 'document': 'RetrySubmission', 'document_schema': 'retry-submission.schema.json', 'external_effect': True, 'failure_codes': ['SOURCE_CONTEXT_STALE', 'PERMIT_MISSING', 'PERMIT_EXPIRED', 'PERMIT_SCOPE_MISMATCH', 'SCHEMA_INVALID', 'PRECONDITION_FAILED', 'CONCURRENT_CROSSING', 'REDUCER_FAILURE'], 'id': 'GATE-RETRY', 'patch': 'RetryIntentPatch', 'patch_schema': 'retry-intent-patch.schema.json', 'permit': 'RetryPermit', 'permit_schema': 'retry-permit.schema.json', 'producer': 'aset-monade-execution', 'producer_component': 'aset.monade', 'reducer_id': 'reducer:gate-retry:v1', 'schema_component': 'aset.protocol', 'writes': ['CTX-EXEC', 'CTX-AUTH']}, {'authority_component': 'aset.core', 'document': 'CompensationSubmission', 'document_schema': 'compensation-submission.schema.json', 'external_effect': True, 'failure_codes': ['SOURCE_CONTEXT_STALE', 'PERMIT_MISSING', 'PERMIT_EXPIRED', 'PERMIT_SCOPE_MISMATCH', 'SCHEMA_INVALID', 'PRECONDITION_FAILED', 'CONCURRENT_CROSSING', 'REDUCER_FAILURE'], 'id': 'GATE-COMPENSATE', 'patch': 'CompensationIntentPatch', 'patch_schema': 'compensation-intent-patch.schema.json', 'permit': 'CompensationPermit', 'permit_schema': 'compensation-permit.schema.json', 'producer': 'aset-monade-execution', 'producer_component': 'aset.monade', 'reducer_id': 'reducer:gate-compensate:v1', 'schema_compone